timestamp	team	body	length	sentiment	subreddit	boo	id	body_full
1619456528.0	Cowboys	D**** I really hope we bring him onto the staff.	48	0.1263	team	0	gvy6z2d	Damn. I really hope we bring him onto the staff.
1619456516.0	49ers	The 49ers traded up from 12 to 3 with someone in mind. It seems bizarre to me that there would be disagreement because everybody had to be in from the beginning on three QBs, right? Lawrence, Wilson and someone else. Also, I find it weird that anyone in the organization would be in disagreement about what Shanahan wants from HIS quarterback.	343	-0.7906	team	0	gvy6y33	The 49ers traded up from 12 to 3 with someone in mind. It seems bizarre to me that there would be disagreement because everybody had to be in from the beginning on three QBs, right? Lawrence, Wilson and someone else. Also, I find it weird that anyone in the organization would be in disagreement about what Shanahan wants from HIS quarterback.
1619456532.0	Buccaneers	Yes, waste of a roster and waste of cap.	40	-0.4404	team	0	gvy6zdg	Yes, waste of a roster and waste of cap.
1619456532.0	49ers	His win loss record is below .500 when Chris Carson is not playing.  Chris Carson is Seattles MVP.	98	0.2283	team	0	gvy6zdv	His win loss record is below .500 when Chris Carson is not playing.  Chris Carson is Seattles MVP.
1619456533.0	Lions	How long were you over here? Im originally from the UK but Ive lived here for 10 years now. I do like Barcelona but it seems to get more touristy by the year (minus the whole pandemic season obviously). Im happy I moved out to a more quiet town )	246	0.8519	team	0	gvy6zg9	How long were you over here? Im originally from the UK but Ive lived here for 10 years now. I do like Barcelona but it seems to get more touristy by the year (minus the whole pandemic season obviously). Im happy I moved out to a more quiet town )
1619456536.0	Broncos	Ive seen your posts and comments and believe you genuinely you give an educated debate. Are you buttering me up? Because its working.I get your argument, im just not prepared to take it as far as you have. We should be cautious with rumors this time of year, but I think there are some that have validity and are worth giving some credence, IMO.	345	0.4883	team	0	gvy6zp1	Ive seen your posts and comments and believe you genuinely you give an educated debate. Are you buttering me up? Because its working.I get your argument, im just not prepared to take it as far as you have. We should be cautious with rumors this time of year, but I think there are some that have validity and are worth giving some credence, IMO.
1619456538.0	Eagles	Bud light made that statue it has 0 to do with howie or the front office. And that just reiterates my point how soft Wentz is.. if he really lets that bother him to the point of playing like the worst QB in the league hes just not made for Philly. Still have love for him but Im happy I wont have to defend the guy for another season, it was exhausting and made football not fun for me. Dont think well be great either way so at least we can develop hurts and he can go have it easy in Indy 	491	0.5781	team	0	gvy6zwu	Bud light made that statue it has 0 to do with howie or the front office. And that just reiterates my point how soft Wentz is.. if he really lets that bother him to the point of playing like the worst QB in the league hes just not made for Philly. Still have love for him but Im happy I wont have to defend the guy for another season, it was exhausting and made football not fun for me. Dont think well be great either way so at least we can develop hurts and he can go have it easy in Indy 
1619456539.0	Texans	Big ups to the mods for this one!	33	0.0	team	0	gvy6zyw	Big ups to the mods for this one!
1619456541.0	Jaguars	Blockchain is a lie proof ledger. IBM and VISA run on blockchain. The Wyoming government is converting to blockchain and countries in Africa have and with opus is announcing their partnership with Cardano soon. Instead of Stewart at the bank running their transaction hundreds of thousands of people run them on the blockchain and verify them. Its a block stack system that cannot be altered therefore big banks and companies cannot lie about transactions. Also the transaction take minutes instead of days or weeks to clear. Blockchain is used to verify product authenticity for manufacturing soon coming to medicines and weed corporations. The real world applications are limitless.  Do your research and start small and grow. Like all investments you will lose as you learn, thats how experience works.	805	-0.128	team	0	gvy7065	Blockchain is a lie proof ledger. IBM and VISA run on blockchain. The Wyoming government is converting to blockchain and countries in Africa have and with opus is announcing their partnership with Cardano soon. Instead of Stewart at the bank running their transaction hundreds of thousands of people run them on the blockchain and verify them. Its a block stack system that cannot be altered therefore big banks and companies cannot lie about transactions. Also the transaction take minutes instead of days or weeks to clear. Blockchain is used to verify product authenticity for manufacturing soon coming to medicines and weed corporations. The real world applications are limitless.  Do your research and start small and grow. Like all investments you will lose as you learn, thats how experience works.
1619456547.0	Packers	I am unreasonably bothered at how out of order these plays are )	64	-0.0772	team	0	gvy70ll	I am unreasonably bothered at how out of order these plays are )
1619456548.0	Browns	Lol I forgot Baker got tased by the cops. What a legend.	56	0.4215	team	0	gvy70qr	Lol I forgot Baker got tased by the cops. What a legend.
1619456553.0	Eagles	Absolutely nothing. Hes old as f****	36	-0.5423	team	0	gvy714u	Absolutely nothing. Hes old as fuck.
1619456556.0	Vikings	Again, late round picks. Calling a 4th rounder a bust is simply ignoring the actual success rate of those picks across the league.Elflein was good prior to his injury. Kalil was great before he gave up. ONeill IS great.  None of these picks are failures by the Vikings, yet they make up 3 of the 5 picks weve made that were third round and higher since the 2000s. Cleveland, the fourth of those 5 picks is looking somewhat promising as well, but its too early to evaluate him.	476	0.6977	team	0	gvy71ej	Again, late round picks. Calling a 4th rounder a bust is simply ignoring the actual success rate of those picks across the league.Elflein was good prior to his injury. Kalil was great before he gave up. ONeill IS great.  None of these picks are failures by the Vikings, yet they make up 3 of the 5 picks weve made that were third round and higher since the 2000s. Cleveland, the fourth of those 5 picks is looking somewhat promising as well, but its too early to evaluate him.
1619456559.0	Bears	Yeah, I still do not want this front office to draft a QB under any circumstance.  They have brought in 4 guys to be the starter, what makes anybody think a fifth will be different.Pace and Nagy are still in the building, are they in charge of the rebuild (that is needed due to their shortcomings)?  Or is this team in it to win now?  Either way, a rookie QB is not the correct answer.	386	0.7301	team	0	gvy71me	Yeah, I still do not want this front office to draft a QB under any circumstance.  They have brought in 4 guys to be the starter, what makes anybody think a fifth will be different.Pace and Nagy are still in the building, are they in charge of the rebuild (that is needed due to their shortcomings)?  Or is this team in it to win now?  Either way, a rookie QB is not the correct answer.
1619456562.0	Eagles	I dont see either if those guys as a guard.  Driscoll looked pretty good though, and they could put him inside	110	0.7269	team	0	gvy71ve	I dont see either if those guys as a guard.  Driscoll looked pretty good though, and they could put him inside
1619456560.0	Steelers	What is so bad about drafting Mayfield? he seems like a consensus 1st round tackle	82	-0.4572	team	0	gvy71q2	What is so bad about drafting Mayfield? he seems like a consensus 1st round tackle
1619456563.0	Falcons	Its not mismanagement if thats the plan from the outset. It only looks d*** if you dont win championships...like our Falcons.	125	-0.7485	team	0	gvy71y6	Its not mismanagement if thats the plan from the outset. It only looks dumb if you dont win championships...like our Falcons.
1619456563.0	Raiders	Theres enough qb talent in this draft I wouldnt be surprised if we actually drafted a long term backup in the later rounds if we dont use the picks to trade	156	0.281	team	0	gvy71zk	Theres enough qb talent in this draft I wouldnt be surprised if we actually drafted a long term backup in the later rounds if we dont use the picks to trade
1619456567.0	Lions	I was there for four years 20102014	35	0.0	team	0	gvy72a5	I was there for four years 20102014
1619456569.0	49ers	The fans dont know anything lol, the subreddit is never the best way to gauge teams interest level	98	-0.4019	team	0	gvy72hm	The fans dont know anything lol, the subreddit is never the best way to gauge teams interest level
1619456570.0	Bears	I am ready to get punched in the d*** once more	47	-0.2023	team	0	gvy72lp	I am ready to get punched in the dick once more
1619456574.0	49ers	Its not a red flag according his history and other people that have had successful careers with the same disorder. Its managed with medication and his family members grew out of it.	181	0.2732	team	0	gvy72xo	Its not a red flag according his history and other people that have had successful careers with the same disorder. Its managed with medication and his family members grew out of it.
1619456581.0	Eagles	That versatility is hard to beat. Especially with an aging, oft injured line	76	-0.4767	team	0	gvy73ih	That versatility is hard to beat. Especially with an aging, oft injured line
1619456590.0	49ers	camera pans to Pete Carroll chewing gum	39	0.0	team	0	gvy749z	camera pans to Pete Carroll chewing gum
1619456592.0	Browns	None of these guys play Corner or Edge...	41	0.34	team	0	gvy74gn	None of these guys play Corner or Edge...
1619456593.0	49ers	Hi Matt love the podcast. Are you able to draw any parallels between the candidates and media frenzy that the 49ers have for the 3 pick in 2021 vs. the same situation with the 49ers with the 1 pick in 2005?	206	0.4404	team	0	gvy74kd	Hi Matt love the podcast. Are you able to draw any parallels between the candidates and media frenzy that the 49ers have for the 3 pick in 2021 vs. the same situation with the 49ers with the 1 pick in 2005?
1619456598.0	Eagles	Hmmm i like that. Makes a ton of sense. I liked how he played though so i hope he is the guy.	93	0.8714	team	0	gvy74wz	Hmmm i like that. Makes a ton of sense. I liked how he played though so i hope he is the guy.
1619456593.0	49ers	Thank you very much. I appreciate that.	39	0.6666	team	0	gvy74im	Thank you very much. I appreciate that.
1619456605.0	Browns	And yet half of this sub wanted to take Trubs over Garrett. Some of the most ridiculous debates I ever got into.	112	-0.4201	team	0	gvy75j1	And yet half of this sub wanted to take Trubs over Garrett. Some of the most ridiculous debates I ever got into.
1619456608.0	49ers	Its gonna be the patriots and theyll start another dynasty.	59	0.0	team	0	gvy75q6	Its gonna be the patriots and theyll start another dynasty.
1619456614.0	49ers	All hail Dream Jimmy	20	0.3182	team	0	gvy768y	All hail Dream Jimmy
1619456619.0	Browns	Agreed, but she also sounds like she smokes 2 packs a day.	58	0.5859	team	0	gvy76nn	Agreed, but she also sounds like she smokes 2 packs a day.
1619456619.0	Bears	Its coming	10	0.0	team	0	gvy76od	Its coming
1619456620.0	Cowboys	I really really wish he could have been healthy more consistently through his career. He would have been a MONSTER for many seasons. He still had glimpses of the beast of old this past season when he played. Thanks for the memories Sean Lee!	241	0.8901	team	0	gvy76qm	I really really wish he could have been healthy more consistently through his career. He would have been a MONSTER for many seasons. He still had glimpses of the beast of old this past season when he played. Thanks for the memories Sean Lee!
1619456621.0	Jets	ZERO. So here he is now(httpswww.kansascity.comsportsnflkansascitychiefsrdn2g7picture131455404alternatesLANDSCAPE1140MIKE)	122	0.0	team	0	gvy76tr	ZERO. So here he is now(httpswww.kansascity.comsportsnflkansascitychiefsrdn2g7picture131455404alternatesLANDSCAPE1140MIKE)
1619456623.0	Buccaneers	Dont forget it can also cost the players money if they have pro bowl nods as an incentive in the contract.	106	0.4881	team	0	gvy7703	Dont forget it can also cost the players money if they have pro bowl nods as an incentive in the contract.
1619456626.0	Browns	I really like this draft! I was cold about drafting a WR in the first cause our defense needs talent but Ive warmed up to it especially after FA. I still think our defense needs more talent	189	0.8974	team	0	gvy77bg	I really like this draft! I was cold about drafting a WR in the first cause our defense needs talent but Ive warmed up to it especially after FA. I still think our defense needs more talent
1619456627.0	Cowboys	You can talk about his injuries all you want, but when when he was on the field...the defense played better.	108	0.8338	team	0	gvy77ea	You can talk about his injuries all you want, but when when he was on the field...the defense played better.
1619456630.0	Titans	Unfortunately not. Hank is a Cowboys fan I think, Bobby would probably be too	77	-0.0258	team	0	gvy77m6	Unfortunately not. Hank is a Cowboys fan I think, Bobby would probably be too
1619456630.0	Patriots	Aw dang, that s***** hes done. He used to be electric, but yeah the injuries have been piling up.Obviously Im biased, but Id expect Edelman to be a stronger candidate than Lee.	176	0.4678	team	0	gvy77n5	Aw dang, that stinks hes done. He used to be electric, but yeah the injuries have been piling up.Obviously Im biased, but Id expect Edelman to be a stronger candidate than Lee.
1619456630.0	Steelers	Ive said it before and Ill say it again if Mason Rudolph is Bens successor then this defense will be absolutely wasted and well be stuck with 78 win mediocre seasons with no playoffs and not great draft picks. No thanks.	220	-0.767	team	0	gvy77nn	Ive said it before and Ill say it again if Mason Rudolph is Bens successor then this defense will be absolutely wasted and well be stuck with 78 win mediocre seasons with no playoffs and not great draft picks. No thanks.
1619456631.0	Bengals	Yes. I think drafting OL with first 2 picks is the way to go. Not only that running lanes open up, but, when Joey now has more time, if no receivers are open he can dump it off to Mixon. He is a serious weapon. A strong running game will really benefit Tee and Tyler. Chase would be awesome, especially with Higgins and Boyd, but it seems unwise to pass on Sewell and another lineman in the second (Humphrey, Cleveland, Leatherwood, or Jenkins if he slides). Nasty Oline is what I want. We play in a nasty division. Who Dey!	524	0.1496	team	0	gvy77re	Yes. I think drafting OL with first 2 picks is the way to go. Not only that running lanes open up, but, when Joey now has more time, if no receivers are open he can dump it off to Mixon. He is a serious weapon. A strong running game will really benefit Tee and Tyler. Chase would be awesome, especially with Higgins and Boyd, but it seems unwise to pass on Sewell and another lineman in the second (Humphrey, Cleveland, Leatherwood, or Jenkins if he slides). Nasty Oline is what I want. We play in a nasty division. Who Dey!
1619456632.0	49ers	Objectively? Source?	20	0.0	team	0	gvy77tq	Objectively? Source?
1619456635.0	Steelers	You can trade down to 32 and pick up a 3rd and 4th. If you trade down with Greenbay who wants to get a WR or if Buffalo wants to get the best pass rushing linebacker jumping Bmore Cleveland still get a 3and4 using same value chart.	231	0.765	team	0	gvy784j	You can trade down to 32 and pick up a 3rd and 4th. If you trade down with Greenbay who wants to get a WR or if Buffalo wants to get the best pass rushing linebacker jumping Bmore Cleveland still get a 3and4 using same value chart.
1619456641.0	49ers	Absolutely.	11	0.0	team	0	gvy78nk	Absolutely.
1619456650.0	Bills	Buffalo needs to upgrade both CB 2 and the big nickel CBSafetyOLB player on the team.Beane could address CB 2 in the 1st round with Caleb Farley or Eric Stokes or Greg Newsome or Ifeatu Melifonwu and then address the big nickel hybrid player in the 2nd round with Hamsah Nasirildeen.Or Beane could address the big nickel hybrid player in the 1st round with Jeremiah OwusuKoramoah (JOK) and CB 2 Tyson Campbell or Paulson Adebo or Aaron Robinson or Trill Williams in the 2nd round.I dont see Buffalo drafting an edge rusher in the 1st or 2nd rounds because a lack of topend talent other than  Azeez Ojulari and the serious injury red flags of Jaelan Phillips. Additionally, Beane invested a 2nd round pick in AJ Epenesa last year and signed Efe Obada in free agency. Epenesa and Obada will be the backups to starters Jerry Hughes and Mario Addison, and because McDermott rotates the DL they will all get a lot of reps. IMO Beane will invest a 1st or 2nd round pick in the 2022 draft at edger usher to replace Mario Addison who is on the last year of his contract.	1062	0.1779	team	0	gvy79er	Buffalo needs to upgrade both CB 2 and the big nickel CBSafetyOLB player on the team.Beane could address CB 2 in the 1st round with Caleb Farley or Eric Stokes or Greg Newsome or Ifeatu Melifonwu and then address the big nickel hybrid player in the 2nd round with Hamsah Nasirildeen.Or Beane could address the big nickel hybrid player in the 1st round with Jeremiah OwusuKoramoah (JOK) and CB 2 Tyson Campbell or Paulson Adebo or Aaron Robinson or Trill Williams in the 2nd round.I dont see Buffalo drafting an edge rusher in the 1st or 2nd rounds because a lack of topend talent other than  Azeez Ojulari and the serious injury red flags of Jaelan Phillips. Additionally, Beane invested a 2nd round pick in AJ Epenesa last year and signed Efe Obada in free agency. Epenesa and Obada will be the backups to starters Jerry Hughes and Mario Addison, and because McDermott rotates the DL they will all get a lot of reps. IMO Beane will invest a 1st or 2nd round pick in the 2022 draft at edger usher to replace Mario Addison who is on the last year of his contract.
1619456654.0	49ers	It is when youre the most injured team in the NFL in both number of players and amount of money being played to those injured players.	134	-0.4576	team	0	gvy79pc	It is when youre the most injured team in the NFL in both number of players and amount of money being played to those injured players.
1619456656.0	Jets	agreedbut d*** you think we woulda been able to guess right once in fifty years lol	83	0.0258	team	0	gvy79wg	agreedbut damn you think we woulda been able to guess right once in fifty years lol
1619456657.0	49ers	It isnt far left like you think it is as Kurt Warner ranks him 4 but could easily be number 2 or 3 on his list.	111	0.4579	team	0	gvy79xh	It isnt far left like you think it is as Kurt Warner ranks him 4 but could easily be number 2 or 3 on his list.
1619456657.0	Falcons	Thanks for this, we aint trading him folks lol and if we did Im burning down my local Home Depots	97	0.6908	team	0	gvy79z7	Thanks for this, we aint trading him folks lol and if we did Im burning down my local Home Depots
1619456657.0	49ers	Correct. That is why I treat those rumors about what they may do (e.g. trading Jimmy G.) as completely made up from nothing.	124	0.4019	team	0	gvy79za	Correct. That is why I treat those rumors about what they may do (e.g. trading Jimmy G.) as completely made up from nothing.
1619456659.0	Giants	I like the idea of trading back with Chicago if we get a haul but I think the upside of Fields is worth a punt considering Jones has not shown signs of being a high end nfl qb	175	0.4767	team	0	gvy7a44	I like the idea of trading back with Chicago if we get a haul but I think the upside of Fields is worth a punt considering Jones has not shown signs of being a high end nfl qb
1619456669.0	Eagles	Im not sure about the actual picks in the draft but I would love an olineman in the first. Kelce, Johnson and Brooks are getting old, and Brooks has a history of injuries and personal issues that have prevented him from playing. I like Mialata and Dillard a lot but Dillard doesnt seem to be a good fit for guard so I think those two will duke it out for the starting LT position.	380	0.9585	team	0	gvy7aza	Im not sure about the actual picks in the draft but I would love an olineman in the first. Kelce, Johnson and Brooks are getting old, and Brooks has a history of injuries and personal issues that have prevented him from playing. I like Mialata and Dillard a lot but Dillard doesnt seem to be a good fit for guard so I think those two will duke it out for the starting LT position.
1619456670.0	49ers	This is such a d*** take, they werent in a position to risk on qbs those years, they used draft capital on dline and oline which is the more important focus when youre building the team.	186	-0.5118	team	0	gvy7b3i	This is such a dumb take, they werent in a position to risk on qbs those years, they used draft capital on dline and oline which is the more important focus when youre building the team.
1619456672.0	Lions	People who catch the ball	25	0.0	team	0	gvy7b9d	People who catch the ball
1619456675.0	Eagles	JJAWs has 29 career catches. They could have gone to Ertz for the record.	73	0.0	team	0	gvy7bij	JJAWs has 29 career catches. They could have gone to Ertz for the record.
1619456678.0	Ravens	Honestly, if hes drops to us, I want Trevon Moehrig. Gives us the dime package again, can cover tight ends and running backs(something we struggle with at times), can play man, good instincts, and lets us play Clark closer to the line. And being better in coverage gives our rushers more time, especially since the pass rushers in this class are a bit murky on how theyll turn out. And the Bengals are likely to grab Chase(or maybe even Pitts). Id like to not relive the mid2010s Ravens v. Bengals games, thanks.	512	0.9432	team	0	gvy7bqq	Honestly, if hes drops to us, I want Trevon Moehrig. Gives us the dime package again, can cover tight ends and running backs(something we struggle with at times), can play man, good instincts, and lets us play Clark closer to the line. And being better in coverage gives our rushers more time, especially since the pass rushers in this class are a bit murky on how theyll turn out. And the Bengals are likely to grab Chase(or maybe even Pitts). Id like to not relive the mid2010s Ravens v. Bengals games, thanks.
1619456679.0	49ers	Mattt!!! Please tell us all these rumors are false and no one has an idea of what our FO is thinking????	104	0.1007	team	0	gvy7btc	Mattt!!! Please tell us all these rumors are false and no one has an idea of what our FO is thinking????
1619456680.0	49ers	Hi Matt! First off, thank you so much for joining us and graciously giving us armchairanalysts your thoughts and opinions, so that we can parrot them and pass them off as our own unique perspectives. Now to the fun part! Most would agree that Kyle Shanahan is a brilliant football mind, and that he and his staff are exceptional at bringing the best out of their players. Still, many fans fear the wrong pick at No. 3 will leave our team in a weaker position.That leaves me with two questions What do you see from Kyle and company that should help alleviate, or could perhaps corroborate that concern? Given the top 3 mostprobable QB prospects (Fields, Jones, Lance), who do you see as having the highest ceiling specifically under Kyle Shanahan and why?	754	0.9613	team	0	gvy7bw8	Hi Matt! First off, thank you so much for joining us and graciously giving us armchairanalysts your thoughts and opinions, so that we can parrot them and pass them off as our own unique perspectives. Now to the fun part! Most would agree that Kyle Shanahan is a brilliant football mind, and that he and his staff are exceptional at bringing the best out of their players. Still, many fans fear the wrong pick at No. 3 will leave our team in a weaker position.That leaves me with two questions What do you see from Kyle and company that should help alleviate, or could perhaps corroborate that concern? Given the top 3 mostprobable QB prospects (Fields, Jones, Lance), who do you see as having the highest ceiling specifically under Kyle Shanahan and why?
1619456682.0	Ravens	Unless jamar chase is there im all set would rather draft 2 guys at the back of the first	89	0.0	team	0	gvy7c2q	Unless jamar chase is there im all set would rather draft 2 guys at the back of the first
1619456684.0	Cardinals	Im 100 sure they know who they are drafting with that pick, analysts can say whatever they want but they do not know what gms are gonna do.	139	0.2023	team	0	gvy7cb1	Im 100 sure they know who they are drafting with that pick, analysts can say whatever they want but they do not know what gms are gonna do.
