timestamp	team	body	length	sentiment	subreddit	boo	id	body_full
1619456986.0	Dolphins	But it CAN. The 49ers dont give a f*** about what the Eagles want to do.	72	0.6399	team	0	gvy8267	But it CAN. The 49ers dont give a fuck about what the Eagles want to do.
1619456988.0	Cardinals	Accurate.	9	0.0	team	0	gvy829r	Accurate.
1619456988.0	Colts	Malik Hooker was the 15th overall pick in the 2017 NFL Draft. S from The Ohio State University. Hooker will be entering his 5th season in the NFL with the previous four all being with the Colts organization. He is currently a free agent as the Colts decline Hookers 5th year option and have yet to resign him. Hooker tore his ACLMCL in the middle of his impressive rookie season and tore his Achilles tendon in week 2 of the 2020 season. Hooker is a ballhawk and when he was drafted, Head Coach Chuck Pagano told him, Youre gonna be our Eddie Reed. A lofty goal for someone that had yet to take a snap. Hooker currently has 124 tackles, 11 pass deflections, and 7 interceptions in 35 career games played. Notes The 2017 draft saw some interesting moves (Bears moving up 1 spot for Mitch Trubisky?). Notable players taken preHooker include DE Myles Garrett (1), RB Leonard Fournette (4), WR Corey Davis (5), S Jamal Adams (6), RB Christian McCaffrey (8), QB Patrick Maholmes (10), CB Marshon Lattimore (11), and QB Deshaun Watson (12). Notable players postHooker include LB TJ Watt (30), S Budda Baker (36), RB Dalvin Cook (41), CB Quincy Wilson (46), WR Juju SmithSchuster (62), RB Alvin Kamara (67), WR Chris Godwin (84), RB Kareem Hunt (86), WR Kenny Golladay (96), S Eddie Jackson (112), RB Marlon Mack (143), TE George Kittle (146), QB wag Kelly (253, Mr. Irrelevant), QBWRRB Taysom Hill (undrafted), and WR Zach Pascal (undrafted).	1436	0.9231	team	0	gvy82b4	Malik Hooker was the 15th overall pick in the 2017 NFL Draft. S from The Ohio State University. Hooker will be entering his 5th season in the NFL with the previous four all being with the Colts organization. He is currently a free agent as the Colts decline Hookers 5th year option and have yet to resign him. Hooker tore his ACLMCL in the middle of his impressive rookie season and tore his Achilles tendon in week 2 of the 2020 season. Hooker is a ballhawk and when he was drafted, Head Coach Chuck Pagano told him, Youre gonna be our Eddie Reed. A lofty goal for someone that had yet to take a snap. Hooker currently has 124 tackles, 11 pass deflections, and 7 interceptions in 35 career games played. Notes The 2017 draft saw some interesting moves (Bears moving up 1 spot for Mitch Trubisky?). Notable players taken preHooker include DE Myles Garrett (1), RB Leonard Fournette (4), WR Corey Davis (5), S Jamal Adams (6), RB Christian McCaffrey (8), QB Patrick Maholmes (10), CB Marshon Lattimore (11), and QB Deshaun Watson (12). Notable players postHooker include LB TJ Watt (30), S Budda Baker (36), RB Dalvin Cook (41), CB Quincy Wilson (46), WR Juju SmithSchuster (62), RB Alvin Kamara (67), WR Chris Godwin (84), RB Kareem Hunt (86), WR Kenny Golladay (96), S Eddie Jackson (112), RB Marlon Mack (143), TE George Kittle (146), QB wag Kelly (253, Mr. Irrelevant), QBWRRB Taysom Hill (undrafted), and WR Zach Pascal (undrafted).
1619456993.0	Eagles	No. Stop. We are rebuilding  dont give those m***** any ideas.	62	-0.0613	team	0	gvy82q3	No. Stop. We are rebuilding  dont give those morons any ideas.
1619456993.0	Titans	The Week 11 Open the door Bobby! was, and still is, one of the funniest things Ive seen in a long time and I thank you for it. Thanks for all the hard work this season, I appreciated seeing it.	193	0.9041	team	0	gvy82q4	The Week 11 Open the door Bobby! was, and still is, one of the funniest things Ive seen in a long time and I thank you for it. Thanks for all the hard work this season, I appreciated seeing it.
1619457001.0	Ravens	Definitely would make that deal, but then would likely trade back from 31 if there was a decent offer on the table	114	0.2144	team	0	gvy83ej	Definitely would make that deal, but then would likely trade back from 31 if there was a decent offer on the table
1619457003.0	Eagles	Hes essentially a tight end. Basically the one position they have a long term answer for. This would be ridiculous.	115	-0.3612	team	0	gvy83ml	Hes essentially a tight end. Basically the one position they have a long term answer for. This would be ridiculous.
1619457008.0	Patriots	Pretty expensive. Would that put us over the cap?	49	0.4939	team	0	gvy83z3	Pretty expensive. Would that put us over the cap?
1619457008.0	Steelers	Whats the difference between what Colbert said and the argument that RB in the first is d*** because the position is worthless and you can plug anyone in there if your line is good enough?	188	-0.7003	team	0	gvy8408	Whats the difference between what Colbert said and the argument that RB in the first is dumb because the position is worthless and you can plug anyone in there if your line is good enough?
1619457017.0	Chiefs	Yeah that foot injury that nearly cost us even getting to the playoffs shall never be an issue according to new OT. Imma hold him to that every time he gives up a sack. Hopefully thats never. Srsly we got effed up with such a hobbled offensive line I was waiting for them to just throw a DT in there.	300	-0.2263	team	0	gvy84qd	Yeah that foot injury that nearly cost us even getting to the playoffs shall never be an issue according to new OT. Imma hold him to that every time he gives up a sack. Hopefully thats never. Srsly we got effed up with such a hobbled offensive line I was waiting for them to just throw a DT in there.
1619457021.0	Eagles	The flashes were really good though. Hitting reagor for a bomb over the shoulder top speed, the leg work, the heart, he already had the respect from the team, etc. Dont tell me there wasnt a difference in the entire team when he was out there. Thats why i think hes the guy.	274	0.8439	team	0	gvy852m	The flashes were really good though. Hitting reagor for a bomb over the shoulder top speed, the leg work, the heart, he already had the respect from the team, etc. Dont tell me there wasnt a difference in the entire team when he was out there. Thats why i think hes the guy.
1619457022.0	Broncos	Fields falling is the dream, realistically I would be thrilled with Lance as well though. Corner or trade down if they cant get either. Do not touch Parsons.	157	0.6597	team	0	gvy856o	Fields falling is the dream, realistically I would be thrilled with Lance as well though. Corner or trade down if they cant get either. Do not touch Parsons.
1619457025.0	Giants	Its a short term deal, but they paid him highend CB money and had to restructure contracts to make it happen.They wouldnt have kicked the can down the road with other players salaries if they didnt have a lot of confidence in Adoree. Look past the length of his contract and at the broader cap implications. They dont make the move if they didnt think hed be a big contributor.	377	0.8847	team	0	gvy85g6	Its a short term deal, but they paid him highend CB money and had to restructure contracts to make it happen.They wouldnt have kicked the can down the road with other players salaries if they didnt have a lot of confidence in Adoree. Look past the length of his contract and at the broader cap implications. They dont make the move if they didnt think hed be a big contributor.
1619457029.0	Giants	I think were genuinely that high on him. But if the Eagles do that and burn draft capital just for a WR on a team thats a sinking ship, fine by me	146	0.296	team	0	gvy85rc	I think were genuinely that high on him. But if the Eagles do that and burn draft capital just for a WR on a team thats a sinking ship, fine by me
1619457030.0	Vikings	Im convinced we wont take a guard until round 4.	48	0.4019	team	0	gvy85vv	Im convinced we wont take a guard until round 4.
1619457035.0	Patriots	Delete this	11	0.0	team	0	gvy868z	Delete this
1619457043.0	Falcons	This is disgusting	18	-0.5267	team	0	gvy86z3	This is disgusting
1619457044.0	Browns	I could watch this all day. That said Matthieu is 100 correct  TFL, partly because Teller had to take him out instead of being available to help further ahead.	159	0.4019	team	0	gvy872j	I could watch this all day. That said Matthieu is 100 correct  TFL, partly because Teller had to take him out instead of being available to help further ahead.
1619457049.0	Dolphins	Dam how you do that. Ive been trying to find ways to write to him for months. Let me know please I really want to send him some letters from maryland	149	0.4391	team	0	gvy87g3	Dam how you do that. Ive been trying to find ways to write to him for months. Let me know please I really want to send him some letters from maryland
1619457055.0	Steelers	You said trade down for a 3rd and a 5th and still get Williams or Etienne. If they are picking at 55...theyre not getting Williams or Etienne.	142	0.0	team	0	gvy87zj	You said trade down for a 3rd and a 5th and still get Williams or Etienne. If they are picking at 55...theyre not getting Williams or Etienne.
1619457057.0	Broncos	But how are those reports credible? Ive heard countless rumors among the years with the draft, alot dont end up happening. Im just saying I wouldnt act so confident that itll happen	181	0.77	team	0	gvy8840	But how are those reports credible? Ive heard countless rumors among the years with the draft, alot dont end up happening. Im just saying I wouldnt act so confident that itll happen
1619457058.0	Browns	You guys remember when we use to have b**** for browns?	55	0.0	team	0	gvy888p	You guys remember when we use to have boobs for browns?
1619457061.0	Eagles	If we wanted a game breaking receiver we should have stayed at 6. Julio is running at 50 speed at this point in his career.	123	0.0	team	0	gvy88gf	If we wanted a game breaking receiver we should have stayed at 6. Julio is running at 50 speed at this point in his career.
1619457066.0	Giants	Small arms but who cares? Our biggest need on the line is guard	63	0.6124	team	0	gvy88ue	Small arms but who cares? Our biggest need on the line is guard
1619457068.0	Bears	The opposite of what Ryan Pace is about to do.Not OP, but if the NagyPace collaboration identified Foles as the better QB on the trade block in 2020, Id rather give Foles an offseason and better protection than pay two backup QBs. Now that we have two top tier backups, we need to take a swing at a draft pick at some place in the draft.	337	0.6652	team	0	gvy891k	The opposite of what Ryan Pace is about to do.Not OP, but if the NagyPace collaboration identified Foles as the better QB on the trade block in 2020, Id rather give Foles an offseason and better protection than pay two backup QBs. Now that we have two top tier backups, we need to take a swing at a draft pick at some place in the draft.
1619457074.0	Lions	Yep been going to him for a few years now. Probably not a good place to be if youre an NFC East fan but other than that its not a bad spot. One of the few who gave the Hock pick love	182	0.8681	team	0	gvy89it	Yep been going to him for a few years now. Probably not a good place to be if youre an NFC East fan but other than that its not a bad spot. One of the few who gave the Hock pick love
1619457084.0	Dolphins	Probably Parsons if all 4 receivers are somehow gone, which I highly doubt.	75	-0.4201	team	0	gvy8ade	Probably Parsons if all 4 receivers are somehow gone, which I highly doubt.
1619457086.0	Cowboys	I always believed in you.	25	0.0	team	0	gvy8ajg	I always believed in you.
1619457087.0	Giants	httpswww.nfl.comnewsdanieljeremiah2020nflmockdraft40bucspickjerryjeudy0ap3000001110524httpsnflspinzone.com20200419newyorkgiantsrumors4thpicknfldraft2020httpsbleacherreport.comarticles28871102020nflmockdraftmattmillersfinal7roundpredictionsTheres Daniel Jeremiah, Matt Miller, Jordan Ranaan , and Mel Kiper all picking someone other than Thomas and those are their final mocks.  Im not sure what this mock draft data base youre referring to is, but its pretty clear after 30 seconds of googling  it cant be those 2 all the way down.	531	0.6507	team	0	gvy8amz	httpswww.nfl.comnewsdanieljeremiah2020nflmockdraft40bucspickjerryjeudy0ap3000001110524httpsnflspinzone.com20200419newyorkgiantsrumors4thpicknfldraft2020httpsbleacherreport.comarticles28871102020nflmockdraftmattmillersfinal7roundpredictionsTheres Daniel Jeremiah, Matt Miller, Jordan Ranaan , and Mel Kiper all picking someone other than Thomas and those are their final mocks.  Im not sure what this mock draft data base youre referring to is, but its pretty clear after 30 seconds of googling  it cant be those 2 all the way down.
1619457087.0	Colts	God I cant wait until tomorrow!gif(giphy3oz8xtlUwlDfw00azu)	59	0.3382	team	0	gvy8aoz	God I cant wait until tomorrow!gif(giphy3oz8xtlUwlDfw00azu)
1619457089.0	Eagles	Prediction  To Buffalo for a 3rd and future 5th	47	0.0	team	0	gvy8asw	Prediction  To Buffalo for a 3rd and future 5th
1619457091.0	49ers	It just doesnt make any sense drafting Mac Jones. Yes Mac Jones might be the best quarterback week 1 but Justin Fields or Trey Lance have a waaayyyy higher ceiling and eventually will be the better QB 23 years down the road	223	0.8074	team	0	gvy8ayo	It just doesnt make any sense drafting Mac Jones. Yes Mac Jones might be the best quarterback week 1 but Justin Fields or Trey Lance have a waaayyyy higher ceiling and eventually will be the better QB 23 years down the road
1619457092.0	Texans	Praise Football Jesus.	22	0.5574	team	0	gvy8b1i	Praise Football Jesus.
1619457097.0	49ers	I mean Jags is a no brainerBut the Jets is for sure a question. Wilson has a good season against lesser competition, and then a Pro day puts him over the edge? Maybe teams were just worried about his surgery the whole time and now the Jets feel okay	249	0.4019	team	0	gvy8bio	I mean Jags is a no brainerBut the Jets is for sure a question. Wilson has a good season against lesser competition, and then a Pro day puts him over the edge? Maybe teams were just worried about his surgery the whole time and now the Jets feel okay
1619457098.0	Texans	Honestly... with something as sensitive as sexual assault.. I was a little unsure on how to proceed.	100	-0.3626	team	0	gvy8bir	Honestly... with something as sensitive as sexual assault.. I was a little unsure on how to proceed.
1619457098.0	Giants	Good thing the biggest hole on our offensive line is the guard position.	72	-0.0258	team	0	gvy8bjt	Good thing the biggest hole on our offensive line is the guard position.
1619457099.0	Eagles	The fact that they traded 6 to then give up the assets you got to move back into the top ten is just m****** and Howie should be fired immediately before he ruins another draft.Also, Kyle Pitts wouldnt even have been there at 6.	228	-0.8271	team	0	gvy8bmz	The fact that they traded 6 to then give up the assets you got to move back into the top ten is just moronic and Howie should be fired immediately before he ruins another draft.Also, Kyle Pitts wouldnt even have been there at 6.
1619457099.0	Steelers	Maybe most years but not this year. Exceptionally deep offensive line draft. Very shallow running back draft.	109	-0.6616	team	0	gvy8bnk	Maybe most years but not this year. Exceptionally deep offensive line draft. Very shallow running back draft.
1619457103.0	Seahawks	Julio with that contract does not cost a first let alone a first and a second.  Hes 32 and has injury issues.  The Falcons would be thrilled to get a second.	157	-0.2263	team	0	gvy8c0v	Julio with that contract does not cost a first let alone a first and a second.  Hes 32 and has injury issues.  The Falcons would be thrilled to get a second.
1619457104.0	Giants	Jones HAS shown the signs of being a high end NFL QB. What he needs to show is consistency. Not giving him freakin year 3 would be a massive mistake	148	-0.5324	team	0	gvy8c4s	Jones HAS shown the signs of being a high end NFL QB. What he needs to show is consistency. Not giving him freakin year 3 would be a massive mistake
1619457105.0	Patriots	Julio is a top 5 wr in the league. Way better than good.	56	0.765	team	0	gvy8c6x	Julio is a top 5 wr in the league. Way better than good.
1619457107.0	Broncos	 Our interest in Teddy has been widely reported, even by some of our local insiders.Reporters love to play connect the dots between former teamsplayerscoaches.  I would to be hesitant to call that activity reporting.Just because Paton was part of a team that thought highly of Bridgewater in the past doesnt mean he automatically thinks that Bridgewater is the right answer for this team now.	392	0.8225	team	0	gvy8ccx	 Our interest in Teddy has been widely reported, even by some of our local insiders.Reporters love to play connect the dots between former teamsplayerscoaches.  I would to be hesitant to call that activity reporting.Just because Paton was part of a team that thought highly of Bridgewater in the past doesnt mean he automatically thinks that Bridgewater is the right answer for this team now.
1619457108.0	Bengals	I had my own extended response, but to your point I still think Pitts would help a lot.The Bengals have lost more games by one score over the last two years than ANY OTHER TEAM in the same time span. So do we really wanna spend a top 5 pick on a guy that wont score any TDs to help us win those close ones? So many questions to ask and trade offs to balance!!	359	0.916	team	0	gvy8cfh	I had my own extended response, but to your point I still think Pitts would help a lot.The Bengals have lost more games by one score over the last two years than ANY OTHER TEAM in the same time span. So do we really wanna spend a top 5 pick on a guy that wont score any TDs to help us win those close ones? So many questions to ask and trade offs to balance!!
1619457114.0	Broncos	Will Paton continue the high character team captain type picks? If so, who are the potential picks that fit this mold?	118	0.4329	team	0	gvy8cx5	Will Paton continue the high character team captain type picks? If so, who are the potential picks that fit this mold?
1619457114.0	Bills	Im a big fan of  Tadarrell Slatons ability as a run stopper but he does need to have a very good weight and strength coach to work with him on losing some weight so he doesnt end up like Terrence Cody a former 2nd round pick who ballooned up in weight and ate himself out of the NFL.	283	0.7026	team	0	gvy8cyx	Im a big fan of  Tadarrell Slatons ability as a run stopper but he does need to have a very good weight and strength coach to work with him on losing some weight so he doesnt end up like Terrence Cody a former 2nd round pick who ballooned up in weight and ate himself out of the NFL.
1619457116.0	Patriots	How does mlombardiNFL feel after RapSheet reported that the 49ers are down to either Mac Jones or Trey Lance with the 3 overall pick in the upcoming NFL Draft?LombardiLine TheWrapRadio posted by VSiNLive(httpstwitter.comVSiNLive)Video in Tweet(httpsvideo.twimg.comamplifyvideo1386715400042205187vid640x360nAitpjYABR7J2XOl.mp4?tag14) (Github)(httpsgithub.comusername)  (Whatsnew)(httpsgithub.comusername)	403	0.0	team	0	gvy8d3a	How does mlombardiNFL feel after RapSheet reported that the 49ers are down to either Mac Jones or Trey Lance with the 3 overall pick in the upcoming NFL Draft?LombardiLine TheWrapRadio posted by VSiNLive(httpstwitter.comVSiNLive)Video in Tweet(httpsvideo.twimg.comamplifyvideo1386715400042205187vid640x360nAitpjYABR7J2XOl.mp4?tag14) (Github)(httpsgithub.comusername)  (Whatsnew)(httpsgithub.comusername)
1619457119.0	Browns	Would you rather the Browns reach for a need or take their best player available?	81	0.6486	team	0	gvy8dd9	Would you rather the Browns reach for a need or take their best player available?
1619457122.0	Patriots	and JC will cost a lot more then gilly. have to look at all the other free agents they have signed for the next few years.	122	0.5106	team	0	gvy8dm8	and JC will cost a lot more then gilly. have to look at all the other free agents they have signed for the next few years.
1619457123.0	Vikings	How do people automatically believe such odd claims?  Julio with his contract, injuryhistory and age makes it highly unlikely he is traded.  I think its more likely that he is traded without a headline like this coming out than if one is.  Agents and or teams are using the media to tell lies to advance agenda.  In this case, someone on the Falvons side is probably exploring this.  Just my feelings.	401	-0.7359	team	0	gvy8dq6	How do people automatically believe such odd claims?  Julio with his contract, injuryhistory and age makes it highly unlikely he is traded.  I think its more likely that he is traded without a headline like this coming out than if one is.  Agents and or teams are using the media to tell lies to advance agenda.  In this case, someone on the Falvons side is probably exploring this.  Just my feelings.
1619457124.0	49ers	I dont think people in the media value Mac Jones. But I think some wellrespected journalists have done the legwork and have come to conclusion that Kyle Shanahan is very high on Mac Jones. Whomever the 49ers pick, itll be somebody they felt the could not get at No. 12 overall. The 49ers took no chances. Thats why they traded up to 3. If theyd gone to 4 or 5 or 6, they would have given another team the opportunity to leap over them. That was a chance the 49ers were not willing to take.	489	0.7195	team	0	gvy8drz	I dont think people in the media value Mac Jones. But I think some wellrespected journalists have done the legwork and have come to conclusion that Kyle Shanahan is very high on Mac Jones. Whomever the 49ers pick, itll be somebody they felt the could not get at No. 12 overall. The 49ers took no chances. Thats why they traded up to 3. If theyd gone to 4 or 5 or 6, they would have given another team the opportunity to leap over them. That was a chance the 49ers were not willing to take.
1619457126.0	49ers	same for clockgame management in Super Bowls	44	0.5994	team	0	gvy8dxy	same for clockgame management in Super Bowls
1619457129.0	Bears	Lol you frequent rconservative	30	0.4215	team	0	gvy8e7w	Lol you frequent rconservative
1619457143.0	Jaguars	What a haul	11	0.0	team	0	gvy8fbf	What a haul
1619457145.0	Eagles	Ok thats what my first point was. We just dont need him. TE is fine just where it is even thought it would be cool to have him	126	0.6486	team	0	gvy8fij	Ok thats what my first point was. We just dont need him. TE is fine just where it is even thought it would be cool to have him
1619457145.0	Eagles	What does anyone think the cost will be to trade back up? 12, Etrz, and a late day three pick enough to get you back up to 7 or 8?If it cost a 1st round pick and change to go from 12 to 6, going from 12 to 7 or 8 is a 2nd at minimum, probably more. Unless the target is a QB its not worth it. And Ertz has no trade value	320	-0.6442	team	0	gvy8fio	What does anyone think the cost will be to trade back up? 12, Etrz, and a late day three pick enough to get you back up to 7 or 8?If it cost a 1st round pick and change to go from 12 to 6, going from 12 to 7 or 8 is a 2nd at minimum, probably more. Unless the target is a QB its not worth it. And Ertz has no trade value
1619457147.0	Browns	I think we all (myself included) forget just how d*** fast OBJ is though. Rondale is fast, but OBJ at full health is a speed demon too	134	-0.3182	team	0	gvy8foi	I think we all (myself included) forget just how damn fast OBJ is though. Rondale is fast, but OBJ at full health is a speed demon too
1619457159.0	Eagles	I mean how would we even know teams are high on him besides what the media tells us? Youre basing this entirely on rumors from the media	136	0.0	team	0	gvy8gno	I mean how would we even know teams are high on him besides what the media tells us? Youre basing this entirely on rumors from the media
1619457159.0	49ers	she doesnt have the reach.	26	-0.0191	team	0	gvy8go7	she doesnt have the reach.
1619457161.0	Ravens	Hes a clown	11	0.0	team	0	gvy8gv5	Hes a clown
1619457163.0	49ers	You based it on fans hahah what a joke	38	0.296	team	0	gvy8gzs	You based it on fans hahah what a joke
1619457164.0	Vikings	Sure hope not	13	0.6369	team	0	gvy8h31	Sure hope not
1619457165.0	Bears	Minority opinion here.   NIners and Lynch always smokescreen.  They did it to us in 2017.Niners didnt need to move up to get Jones if hes their guy.  I think they will take Fields if hes there, otherwise Lance.  Makes no sense to trade 31st rd picks and a 3rd rd pick to draft someone that probably would have been there at 12.	327	-0.296	team	0	gvy8h84	Minority opinion here.   NIners and Lynch always smokescreen.  They did it to us in 2017.Niners didnt need to move up to get Jones if hes their guy.  I think they will take Fields if hes there, otherwise Lance.  Makes no sense to trade 31st rd picks and a 3rd rd pick to draft someone that probably would have been there at 12.
1619457169.0	Buccaneers	This photo is cursed	20	0.0	team	0	gvy8hj2	This photo is cursed
1619457175.0	Patriots	I usually max out my PTP every fiscal year	42	0.0	team	0	gvy8i14	I usually max out my PTP every fiscal year
1619457177.0	49ers	please no	9	0.0258	team	0	gvy8i7q	please no
1619457179.0	Eagles	If you put the words together it sounds funky, but the title is no different than reporter saying the Eagles will certainly trade Ertz by the end of the draft	158	0.0258	team	0	gvy8ica	If you put the words together it sounds funky, but the title is no different than reporter saying the Eagles will certainly trade Ertz by the end of the draft
