timestamp	team	body	length	sentiment	subreddit	boo	id	body_full
1619456838.0	Browns	He just seems small for that position at the nFL level. Im probably wrong though	80	-0.4767	team	0	gvy7pgb	He just seems small for that position at the nFL level. Im probably wrong though
1619456842.0	Cardinals	Im hoping they select Mac Jones	31	0.4215	team	0	gvy7psb	Im hoping they select Mac Jones
1619456842.0	Eagles	I hope youre right but why do you feel that way? He showed some flashes last year but hard to say 100 sure.	107	0.5106	team	0	gvy7psc	I hope youre right but why do you feel that way? He showed some flashes last year but hard to say 100 sure.
1619456846.0	Giants	Thats an incorrect takeaway from my statement. It affects expectation level which is my point. Now if you want to say that I inferred losing more championship games than winning is embarrassing, you would be correct. However, no where did I state it was a negative.	265	-0.4951	team	0	gvy7q6i	Thats an incorrect takeaway from my statement. It affects expectation level which is my point. Now if you want to say that I inferred losing more championship games than winning is embarrassing, you would be correct. However, no where did I state it was a negative.
1619456848.0	Eagles	Can stockpile more picks if we can trade Brooks	47	0.0	team	0	gvy7qcw	Can stockpile more picks if we can trade Brooks
1619456859.0	Titans	Im so done with these moc drafts	32	0.0	team	0	gvy7r9k	Im so done with these moc drafts
1619456869.0	Patriots	its not smart business to extend a 30 cb coming off a major injury, smarter to bet on JC being a solid 1 who is worse than gilmore but still better than a lot of teams 1	169	0.443	team	0	gvy7s3l	its not smart business to extend a 30 cb coming off a major injury, smarter to bet on JC being a solid 1 who is worse than gilmore but still better than a lot of teams 1
1619456871.0	Dolphins	I am bummed that NBC is losing the NHL (definitely in the minority amongst hockey fans) however, I hope this opens the door to the network pursuing the NBA in a few years. I cant say Ive been overly impressed with ESPNABCs NBA coverage and always thought NBC had a superior product. Id be ok with Turner Sports keeping its NBA package as well, while the idea of the NBA moving to CBS or FOX makes my stomach turn.	413	0.9169	nfl	0	gvy7s9l	I am bummed that NBC is losing the NHL (definitely in the minority amongst hockey fans) however, I hope this opens the door to the network pursuing the NBA in a few years. I cant say Ive been overly impressed with ESPNABCs NBA coverage and always thought NBC had a superior product. Id be ok with Turner Sports keeping its NBA package as well, while the idea of the NBA moving to CBS or FOX makes my stomach turn.
1619456873.0	Broncos	Until we actually pull the trigger on Bridgewater, I am of the mind that the people linking us to him are people who are not in the know, so to speak. People see an available quarterback and a team with a need, so they make up scenarios. But it makes no sense from inside our building to make this move without receiving exceptional compensation. He just doesnt provide a sufficiently obvious and glaring upgrade that we would take the financial risk. (Also, with all the disrespect that flies around here, you are deserving of a little praise. However, when next we meet, we meet as enemies)	592	-0.8397	team	0	gvy7sgz	Until we actually pull the trigger on Bridgewater, I am of the mind that the people linking us to him are people who are not in the know, so to speak. People see an available quarterback and a team with a need, so they make up scenarios. But it makes no sense from inside our building to make this move without receiving exceptional compensation. He just doesnt provide a sufficiently obvious and glaring upgrade that we would take the financial risk. (Also, with all the disrespect that flies around here, you are deserving of a little praise. However, when next we meet, we meet as enemies)
1619456883.0	49ers	Why have the 49ers not learned anything from the Rueben Foster situation and looking at a guy FROM Alabama with character issues in Mac Jones ?	143	0.0	team	0	gvy7tad	Why have the 49ers not learned anything from the Rueben Foster situation and looking at a guy FROM Alabama with character issues in Mac Jones ?
1619456883.0	49ers	Hey matt been listening to the Pod as long as its been available, tell Laura more horns! Lol This has been an incredibly tough last month for fans, because honestly, from 90 of our views, this should be a relatively easy decision for the 49ers.  Do you think there will be any lasting effects realistically if this pick, which by all accounts will be universally disagreed with, doesnt work out? Also, who is personally your favorite 49ers player of all time on the field? What about off the field? Thanks for stopping by.	522	0.9004	team	0	gvy7taw	Hey matt been listening to the Pod as long as its been available, tell Laura more horns! Lol This has been an incredibly tough last month for fans, because honestly, from 90 of our views, this should be a relatively easy decision for the 49ers.  Do you think there will be any lasting effects realistically if this pick, which by all accounts will be universally disagreed with, doesnt work out? Also, who is personally your favorite 49ers player of all time on the field? What about off the field? Thanks for stopping by.
1619456883.0	Cowboys	Cowboy legend. So sad injuries got the best of him. He may not be on the field anymore but hes still going to rock the star	123	0.0269	team	0	gvy7tbq	Cowboy legend. So sad injuries got the best of him. He may not be on the field anymore but hes still going to rock the star
1619456885.0	Steelers	RB in the first, Quinn M in the 2nd, Tremble in the 3rd and ill be very happy.	78	0.024	team	0	gvy7tgk	RB in the first, Quinn M in the 2nd, Tremble in the 3rd and ill be very happy.
1619456890.0	Eagles	He could be better suited for guard for all we know but hes pretty versatile for all over the line.  I definitely think hes pro bowl level wherever he ends up	158	0.8689	team	0	gvy7txj	He could be better suited for guard for all we know but hes pretty versatile for all over the line.  I definitely think hes pro bowl level wherever he ends up
1619456892.0	Ravens	The only players I think trading up for would be worth would be Chase, Waddle, Pitts, or Smith, and all 4 will almost definitely be gone by pick 18, so I think this trade is a no for me. I dont know if Bateman will be there at 27, but if hes there at 18 then hed be there at like 22 or 23 probably. I wouldnt hate giving up less to trade up 4 or 5 spots and lock Bateman up.	374	0.7389	team	0	gvy7u2g	The only players I think trading up for would be worth would be Chase, Waddle, Pitts, or Smith, and all 4 will almost definitely be gone by pick 18, so I think this trade is a no for me. I dont know if Bateman will be there at 27, but if hes there at 18 then hed be there at like 22 or 23 probably. I wouldnt hate giving up less to trade up 4 or 5 spots and lock Bateman up.
1619456894.0	Eagles	Hed need to rework his deal, not just for cap reasons but future seasons. Were not in win now mode and by the time we are hes probably 3435 years old. So Im out.	161	-0.6259	team	0	gvy7u7y	Hed need to rework his deal, not just for cap reasons but future seasons. Were not in win now mode and by the time we are hes probably 3435 years old. So Im out.
1619456895.0	Steelers	I wouldnt hate it.	18	0.4585	team	0	gvy7ucq	I wouldnt hate it.
1619456897.0	49ers	Door number  303303  3 (pick)  101101  75 (75th year Anniversary)  26 26  22 (Fields age)  4 4  3 (pick)  1Justin Fields jersey number 1	136	0.1531	team	0	gvy7ugq	Door number  303303  3 (pick)  101101  75 (75th year Anniversary)  26 26  22 (Fields age)  4 4  3 (pick)  1Justin Fields jersey number 1
1619456900.0	Dolphins	D*** I lurk here a lot but I had to comment that this is pretty gnarly	70	0.4678	team	0	gvy7uqk	Damn I lurk here a lot but I had to comment that this is pretty gnarly
1619456902.0	Falcons	Better a year too early than a year too late. After hanging onto Roddy until the wheels fell off I can at least see the value in moving him now.Id rather be able to sign our draft class, extend Ridley, and have 20 mil to spend in 2022  2023 than keep Julio here on a perpetual limited snap count until hes 34 years old.  Is Gage anywhere near as good as Julio? Of course not. But is Julio 20ish million better than Gage and good enough to offset glaring holes his salary creates at other positions? If the answer is no then its time to deal him.	545	0.9083	team	0	gvy7uvz	Better a year too early than a year too late. After hanging onto Roddy until the wheels fell off I can at least see the value in moving him now.Id rather be able to sign our draft class, extend Ridley, and have 20 mil to spend in 2022  2023 than keep Julio here on a perpetual limited snap count until hes 34 years old.  Is Gage anywhere near as good as Julio? Of course not. But is Julio 20ish million better than Gage and good enough to offset glaring holes his salary creates at other positions? If the answer is no then its time to deal him.
1619456903.0	Packers	The AZ cardinal one is the best!  Had to throw it up there while being pressuredhit.	84	0.6696	team	0	gvy7uzq	The AZ cardinal one is the best!  Had to throw it up there while being pressuredhit.
1619456904.0	Bears	Anybody think drafting a quarterback this time will be different with Nagy involved in the process?	99	0.0	team	0	gvy7v3p	Anybody think drafting a quarterback this time will be different with Nagy involved in the process?
1619456905.0	Bears	Yay, race bait.	15	0.5267	team	0	gvy7v8g	Yay, race bait.
1619456907.0	Falcons	They canttrade him until June 1	31	0.0	team	0	gvy7vew	They canttrade him until June 1
1619456907.0	Cowboys	He isnt? I thought he wanted a coaching gig with Dallas	55	0.0	team	0	gvy7vez	He isnt? I thought he wanted a coaching gig with Dallas
1619456908.0	49ers	Im honestly not afraid of whoever we pick. Our offense is built to run the rock and scheme guys wide open. We know Mac Jones can hit guys that are wide open.  Granted a QB that can escape and get your 10 to 15 yards per escape  run sounds amazing too.  x200BMy worry is the small inkling in the back of my head that if this pick falls flat we have wasted our resources and are doomed. I would say no matter who we pick though, has about a 80 chance of success.. I didnt do math here I just know Shanahan gets guys open and the foundation around the new QB is made of marble  granite?  DIAMOND??? Although there is going to be a pretty awkward times in the locker room I can imagine as soon as the new QB walks in.	713	0.8354	team	0	gvy7vfj	Im honestly not afraid of whoever we pick. Our offense is built to run the rock and scheme guys wide open. We know Mac Jones can hit guys that are wide open.  Granted a QB that can escape and get your 10 to 15 yards per escape  run sounds amazing too.  x200BMy worry is the small inkling in the back of my head that if this pick falls flat we have wasted our resources and are doomed. I would say no matter who we pick though, has about a 80 chance of success.. I didnt do math here I just know Shanahan gets guys open and the foundation around the new QB is made of marble  granite?  DIAMOND??? Although there is going to be a pretty awkward times in the locker room I can imagine as soon as the new QB walks in.
1619456908.0	Steelers	Literally any OT outside of Slater and Sewell could be there at 24.One of Darrisaw and Vera Tucker could very well be there. ESPN has Darrisaw 25 on their big board. CBS has Vera Tucker 19. PFF has Vera Tucker at 21 and Darrisaw at 15.  Little is literally only is falling in mocks because he sat out. Hes absolutely one of the best OT prospects in the draft. Sleestak, we have literally never agreed over the years (old account was kanyewestgayfish), but I urge you to remember Decastro. Was projected between 8 and 12 and we got him at what, 21?	547	0.2936	team	0	gvy7viv	Literally any OT outside of Slater and Sewell could be there at 24.One of Darrisaw and Vera Tucker could very well be there. ESPN has Darrisaw 25 on their big board. CBS has Vera Tucker 19. PFF has Vera Tucker at 21 and Darrisaw at 15.  Little is literally only is falling in mocks because he sat out. Hes absolutely one of the best OT prospects in the draft. Sleestak, we have literally never agreed over the years (old account was kanyewestgayfish), but I urge you to remember Decastro. Was projected between 8 and 12 and we got him at what, 21?
1619456910.0	Steelers	They are retooling on the fly they have 4 o linemen at new spots new CB2 NB new milb no safety depth or OLB depth	113	-0.3252	team	0	gvy7vp0	They are retooling on the fly they have 4 o linemen at new spots new CB2 NB new milb no safety depth or OLB depth
1619456923.0	Saints	I should specify the never ending whos taking who discussions i.e. who the 49ers are drafting and why its 3 different people all at once	136	0.0	team	0	gvy7wqg	I should specify the never ending whos taking who discussions i.e. who the 49ers are drafting and why its 3 different people all at once
1619456923.0	Giants	Exactly my point lol	20	0.4215	team	0	gvy7wrw	Exactly my point lol
1619456926.0	49ers	We should ask ourselves why the Jets and Jaguars arent even considering Fields with their picks. Is he a trully QB2 talent or it was just the mediapublic perception?	165	0.6908	team	0	gvy7x01	We should ask ourselves why the Jets and Jaguars arent even considering Fields with their picks. Is he a trully QB2 talent or it was just the mediapublic perception?
1619456929.0	Panthers	Im still holding out hope that with him being with the scouts, he can help them find another middle linebacker close to his level of skill. There will never be another Luke Kuechly, but anything close to that would be welcomed here in Carolina. Think we were a bit spoiled for a while having Dan Morgan, Jon Beason, Luke Kuechly, Thomas Davis, and Shaq at linebacker over the years. Just feels weird not having a stable linebacker corps.	437	0.3649	team	0	gvy7xai	Im still holding out hope that with him being with the scouts, he can help them find another middle linebacker close to his level of skill. There will never be another Luke Kuechly, but anything close to that would be welcomed here in Carolina. Think we were a bit spoiled for a while having Dan Morgan, Jon Beason, Luke Kuechly, Thomas Davis, and Shaq at linebacker over the years. Just feels weird not having a stable linebacker corps.
1619456931.0	Eagles	My point was that hes got all these little things nagging in his head from outside sources. Sports Radio saying h*** never be Foles. F****** beer companies making statues of his backup. The proper way to deal with that is to sit down with him and say Hey Carson, you are our guy. We know you can do this and build the team to support him. Not use a 2nd round pick on a Big 12 QB. That just makes the whispers louder.I know But theyre professional athletes! but they are still human.	482	-0.4502	team	0	gvy7xdu	My point was that hes got all these little things nagging in his head from outside sources. Sports Radio saying hell never be Foles. Fucking beer companies making statues of his backup. The proper way to deal with that is to sit down with him and say Hey Carson, you are our guy. We know you can do this and build the team to support him. Not use a 2nd round pick on a Big 12 QB. That just makes the whispers louder.I know But theyre professional athletes! but they are still human.
1619456933.0	Giants	lol I think counting lost comp picks is stretching a little but yeah, agreed.	77	0.5976	team	0	gvy7xjb	lol I think counting lost comp picks is stretching a little but yeah, agreed.
1619456933.0	Steelers	Yeah I end up with the same discussion with you on pretty much every one of these threads. Suffice to say we disagree on this. I think its much easier to find a quality starting running back in mid rounds than a quality starting tackle.	236	0.6808	team	0	gvy7xkf	Yeah I end up with the same discussion with you on pretty much every one of these threads. Suffice to say we disagree on this. I think its much easier to find a quality starting running back in mid rounds than a quality starting tackle.
1619456938.0	Falcons	Personally ill riot if we trade Julio for anything but 3 firsts and to a contender so he has a chance at a ring	111	0.0129	team	0	gvy7y20	Personally ill riot if we trade Julio for anything but 3 firsts and to a contender so he has a chance at a ring
1619456939.0	Vikings	httpsyoutu.beWoFb8yIFJSw I just mean the beginning of this.	59	0.0	team	0	gvy7y2a	httpsyoutu.beWoFb8yIFJSw I just mean the beginning of this.
1619456941.0	Bills	The analytics tell you not to draft a RB in the 1st round. I wouldnt be upset with a RB taken in the 1st round if Beane has him rated highly on his big board, but I would prefer the holes at CB 2 or RGC are addressed in the 1st round.	234	0.1511	team	0	gvy7y7o	The analytics tell you not to draft a RB in the 1st round. I wouldnt be upset with a RB taken in the 1st round if Beane has him rated highly on his big board, but I would prefer the holes at CB 2 or RGC are addressed in the 1st round.
1619456946.0	Dolphins	Fuller cant be depended on.	27	0.0	team	0	gvy7yov	Fuller cant be depended on.
1619456947.0	Ravens	Im all for Moehrig as well. Hes one of My Guys as well, just shortened the list a little for here. I think he would be a huge asset on the back end, just leaves DeShon in an unfortunate situation.	196	0.6124	team	0	gvy7yst	Im all for Moehrig as well. Hes one of My Guys as well, just shortened the list a little for here. I think he would be a huge asset on the back end, just leaves DeShon in an unfortunate situation.
1619456950.0	Patriots	Nahh Bill is taking the highest DTDE he can find. Everyone else is looking for QB and WR groups, Bill is looking everywhere else.	129	-0.1027	team	0	gvy7z0d	Nahh Bill is taking the highest DTDE he can find. Everyone else is looking for QB and WR groups, Bill is looking everywhere else.
1619456952.0	49ers	It sure seems that way to me. Right? They did not have to make this bold move. They could have remained at No. 12 and taken a cornerback  like I thought they would. But this sure seems to me like they are pushing all the chips to the middle of the table with this one. If their QB turns out to be a bust, it very well may cost them their jobs in four years.	357	0.9213	team	0	gvy7z8t	It sure seems that way to me. Right? They did not have to make this bold move. They could have remained at No. 12 and taken a cornerback  like I thought they would. But this sure seems to me like they are pushing all the chips to the middle of the table with this one. If their QB turns out to be a bust, it very well may cost them their jobs in four years.
1619456955.0	Bills	I have always liked the Bills fans, but when you guys took the chance and drafted Josh, I became a Bills fan. You got a ton of new fans from Wyoming Trust me. It has only gotten better since Josh proved most of the haters wrong, yes even some of you guys....The Bills and Josh are such a  good fit.  Best Wishes Guys from Wyoming I see a SB in the future for you. Josh will only get better!!!	392	0.9823	team	0	gvy7zg8	I have always liked the Bills fans, but when you guys took the chance and drafted Josh, I became a Bills fan. You got a ton of new fans from Wyoming Trust me. It has only gotten better since Josh proved most of the haters wrong, yes even some of you guys....The Bills and Josh are such a  good fit.  Best Wishes Guys from Wyoming I see a SB in the future for you. Josh will only get better!!!
1619456957.0	Bengals	Like Sewell, I think Pitts is another cant miss prospect. So between the two of them it comes down to team need. Lemme put it like thisIn terms of offensive production, the prospects go Chase, Pitts, Sewell. Chase making the biggest impact as an elite receiver, Sewell making the smallest as an elite blocker (not to say Sewell wont be good! Just to say h*** do the least in terms of direct offensive production)In terms of team need by position, the prospects go Sewell, Chase, Pitts. Sewell being the biggest need as an OL, Pitts being the least as TE, who does half the job of an elite blocker and half the job of an elite receiver.Chase gets 3 points for being the top producer and 2 points for the second biggest need. 5Sewell gets 1 point for being the lowest producer and 3 points for the biggest need. 4Pitts gets 2 points for being the middle producer and 1 point for being the lowest need. 3This is obviously personal opinion, but its just an easy way to show how I mentally rank these prospects. But of course, I think all of them would greatly benefit us.	1067	0.7996	team	0	gvy7zn6	Like Sewell, I think Pitts is another cant miss prospect. So between the two of them it comes down to team need. Lemme put it like thisIn terms of offensive production, the prospects go Chase, Pitts, Sewell. Chase making the biggest impact as an elite receiver, Sewell making the smallest as an elite blocker (not to say Sewell wont be good! Just to say hell do the least in terms of direct offensive production)In terms of team need by position, the prospects go Sewell, Chase, Pitts. Sewell being the biggest need as an OL, Pitts being the least as TE, who does half the job of an elite blocker and half the job of an elite receiver.Chase gets 3 points for being the top producer and 2 points for the second biggest need. 5Sewell gets 1 point for being the lowest producer and 3 points for the biggest need. 4Pitts gets 2 points for being the middle producer and 1 point for being the lowest need. 3This is obviously personal opinion, but its just an easy way to show how I mentally rank these prospects. But of course, I think all of them would greatly benefit us.
1619456957.0	Bears	Everything I disagree with is r***** too.	41	-0.765	team	0	gvy7znf	Everything I disagree with is racist too.
1619456960.0	Dolphins	What frequency? It was once?	28	0.0	team	0	gvy7zz6	What frequency? It was once?
1619456963.0	Cowboys	 floor of a great shutdown starter in the nflSo is his ceiling Deion Sanders then?	82	0.6249	team	0	gvy8061	 floor of a great shutdown starter in the nflSo is his ceiling Deion Sanders then?
1619456966.0	Ravens	Who are you trying to get?  Who is left on the board?	53	0.0	team	0	gvy80fn	Who are you trying to get?  Who is left on the board?
1619456970.0	Ravens	Twitters hilarious with these falcon fans saying well the Ravens have two first round picks I guess if they throwing something else in that might get it done lmao I think itll take a third and a conditional pick in 2022 Now that Ive read more into it. But Im also open to trading the first in exchange for some ATL picks this year coming back with Julio. Also remember weve dealt with ATL when we traded Hurst and got a 2nd! So we have an existing relationship. If we want to get this done this will get done.	509	0.68	team	0	gvy80qk	Twitters hilarious with these falcon fans saying well the Ravens have two first round picks I guess if they throwing something else in that might get it done lmao I think itll take a third and a conditional pick in 2022 Now that Ive read more into it. But Im also open to trading the first in exchange for some ATL picks this year coming back with Julio. Also remember weve dealt with ATL when we traded Hurst and got a 2nd! So we have an existing relationship. If we want to get this done this will get done.
1619456971.0	Steelers	No wouldnt get a 2nd they are taking a RB in round 1 then TE or C in round 2	76	-0.296	team	0	gvy80vf	No wouldnt get a 2nd they are taking a RB in round 1 then TE or C in round 2
1619456979.0	Eagles	Its Pitts is somehow at 78 you have to make the trade so New York and Dallas dont get a generational tight end for the next decade. I dont give a d*** what it cost as long as its not a first rounder.	199	0.3089	team	0	gvy81k0	Its Pitts is somehow at 78 you have to make the trade so New York and Dallas dont get a generational tight end for the next decade. I dont give a damn what it cost as long as its not a first rounder.
1619456981.0	Buccaneers	The whole point of my comment was that the falcons organization is still a jokeNo it wasnt, youre just trying to cover your a** now. Also Im not sure why youre being so hostile right now. Because 283 isnt relevant to anything today, but youre pretending like just mentioning it is the same thing as making a nuanced comment about the Falcons org. We were down 277 against the Falcons at one point last season, so even under a diff HC and GM they still played us close. So it makes sense to say that Falcons  offensive minded HC  best athlete in the draft  they will be scary team against our defense. Believe it or not that has nothing to do with Brady or 283. Also what more does Brady have to do to earn peoples respect?Thats not what this is about. Hope you have a good day, keep downvoting me lol.Will do )	810	0.8746	team	0	gvy81pg	The whole point of my comment was that the falcons organization is still a jokeNo it wasnt, youre just trying to cover your ass now. Also Im not sure why youre being so hostile right now. Because 283 isnt relevant to anything today, but youre pretending like just mentioning it is the same thing as making a nuanced comment about the Falcons org. We were down 277 against the Falcons at one point last season, so even under a diff HC and GM they still played us close. So it makes sense to say that Falcons  offensive minded HC  best athlete in the draft  they will be scary team against our defense. Believe it or not that has nothing to do with Brady or 283. Also what more does Brady have to do to earn peoples respect?Thats not what this is about. Hope you have a good day, keep downvoting me lol.Will do )
