timestamp	team	body	length	sentiment	subreddit	boo	id	body_full
1619457179.0	Packers	We really do need to add another starting caliber OL in the draft this year. Patrick did well enough and Runyan showed some promise, but I would not be exactly be thrilled to have both them as our starting OGs. However because of the flexibility on our OL, adding a player at really any position would be good enough to make our OL solid. I would be fine with Patrick and Runyan competing for 1 starting OG spot.	412	0.9442	team	0	gvy8icy	We really do need to add another starting caliber OL in the draft this year. Patrick did well enough and Runyan showed some promise, but I would not be exactly be thrilled to have both them as our starting OGs. However because of the flexibility on our OL, adding a player at really any position would be good enough to make our OL solid. I would be fine with Patrick and Runyan competing for 1 starting OG spot.
1619457184.0	Buccaneers	No. Two reasons. A veterans are not allowed to be on the practice squad. The purpose of the practice squad is for developing young projects, not stashing veterans to run your practices. B even if we were allowed to, PS players are paid weekly and not by salary. I dont remember the numbers but their max salary is like 200kyr. I also dont remember RGs salary offhand, but its probably around 1milyr. if we underpaid him, he probably finds employment elsewhere.	460	0.5023	team	0	gvy8isg	No. Two reasons. A veterans are not allowed to be on the practice squad. The purpose of the practice squad is for developing young projects, not stashing veterans to run your practices. B even if we were allowed to, PS players are paid weekly and not by salary. I dont remember the numbers but their max salary is like 200kyr. I also dont remember RGs salary offhand, but its probably around 1milyr. if we underpaid him, he probably finds employment elsewhere.
1619457189.0	Panthers	I see you didnt watch the pats last year. Even Bill couldnt get them to the playoffs and hes gonna cost them this year too if they dont get Mac Jones.	150	0.0	team	0	gvy8j6b	I see you didnt watch the pats last year. Even Bill couldnt get them to the playoffs and hes gonna cost them this year too if they dont get Mac Jones.
1619457191.0	Giants	Id give him a year 3 if Fields is gone at 11 but you cant compare the two and say Jones has a higher upside	107	0.0	team	0	gvy8jeo	Id give him a year 3 if Fields is gone at 11 but you cant compare the two and say Jones has a higher upside
1619457191.0	Eagles	He definitely has all the intangibles. Hoping the off season work hes putting in pays off. Even though we might s**** Im excited for next season.	145	0.6124	team	0	gvy8jeu	He definitely has all the intangibles. Hoping the off season work hes putting in pays off. Even though we might suck, Im excited for next season.
1619457193.0	49ers	Agreed	6	0.2732	team	0	gvy8jjf	Agreed
1619457193.0	Patriots	The suggestion to take 2 years to develop has its own issues. You are effectively doubling the cost. At that point  getting a vet role player starts to be a viable alternative. One year of development is ok for a third rounder, but two starts to stretch it.	257	0.3716	team	0	gvy8jkq	The suggestion to take 2 years to develop has its own issues. You are effectively doubling the cost. At that point  getting a vet role player starts to be a viable alternative. One year of development is ok for a third rounder, but two starts to stretch it.
1619457196.0	Steelers	Colbert literally said there is good RB and Tackle depth. Why would you think we take a RB round 1? Its just as likely we go RB round 23 as OT round 23	151	0.4404	team	0	gvy8jte	Colbert literally said there is good RB and Tackle depth. Why would you think we take a RB round 1? Its just as likely we go RB round 23 as OT round 23
1619457200.0	49ers	Eh its impossible for me to get TOO hard on him since I just dont know who made which pick. But guys like joe williams and Dante pettis keep him from climbing any higher imo.	174	0.4678	team	0	gvy8k4g	Eh its impossible for me to get TOO hard on him since I just dont know who made which pick. But guys like joe williams and Dante pettis keep him from climbing any higher imo.
1619457202.0	Rams	We have draft picks? Lmao. Its nice seeing him more animated. The dude has talked like a scripted robot in everything weve seen him in since the trade. Cant wait to see him light s*** up though!That hat Hekker is wearing is Sneads glasses are goofy and great at the same time.I need those couch pillows.Its still wierd that Rebel looks hot now. I mean, to me at least.	368	0.8553	team	0	gvy8kau	We have draft picks? Lmao. Its nice seeing him more animated. The dude has talked like a scripted robot in everything weve seen him in since the trade. Cant wait to see him light shit up though!That hat Hekker is wearing is Sneads glasses are goofy and great at the same time.I need those couch pillows.Its still wierd that Rebel looks hot now. I mean, to me at least.
1619457202.0	Packers	Moore isnt lasting until 36	27	0.0	team	0	gvy8kca	Moore isnt lasting until 36
1619457204.0	49ers	Nice story!	11	0.4753	team	0	gvy8kfk	Nice story!
1619457204.0	Giants	So were getting Parsons.  this is 2018 all over again with Barkley, Allen and Darnold	85	0.0	team	0	gvy8kg5	So were getting Parsons.  this is 2018 all over again with Barkley, Allen and Darnold
1619457204.0	Browns	I probably would hahahaha	25	0.0	team	0	gvy8kjd	I probably would hahahaha
1619457207.0	Giants	Oh I agree totally but its DG man	33	0.1901	team	0	gvy8kqc	Oh I agree totally but its DG man
1619457208.0	Eagles	T.O. has a better chance than Reagor.	37	0.5994	team	0	gvy8ktp	T.O. has a better chance than Reagor.
1619457208.0	Bears	Thats kind of what I thought and imo you guys did pretty good. Granted I have no idea on most prospects past day 2. Get Toney and Jones is a win. I have heard guys will surprisingly fall due to medicals this year. So hopefully if theres another EJax like opportunity bears make a push. I have seen others mock CB early but to me unless Surtain or Horn are somehow there at 20 theres no shot imo.	395	0.784	team	0	gvy8kva	Thats kind of what I thought and imo you guys did pretty good. Granted I have no idea on most prospects past day 2. Get Toney and Jones is a win. I have heard guys will surprisingly fall due to medicals this year. So hopefully if theres another EJax like opportunity bears make a push. I have seen others mock CB early but to me unless Surtain or Horn are somehow there at 20 theres no shot imo.
1619457210.0	Cowboys	Adam Shefter wants to know your location	40	0.0	team	0	gvy8l1x	Adam Shefter wants to know your location
1619457216.0	Buccaneers	Colts dont have anyone to draw coverage.	40	0.0	team	0	gvy8lgd	Colts dont have anyone to draw coverage.
1619457222.0	Patriots	Yes, Kyle dugger was the right pick. I think hes a future leader on this defense and has the physical tools to stop these next gen guys. Really hoping to see him force a fumble on josh Allen with a big hit the next time he tries to scramble on us. Will also be clutch against guys like Lamar, Tua, watson (assuming his career isnt over) and even may take the scrambling option away from sometimes scramblers like mahomes or tannehill. Absolutely necessary if make it to the AFC championship game, itll likely be against one of those QBs.	537	0.9025	team	0	gvy8lyr	Yes, Kyle dugger was the right pick. I think hes a future leader on this defense and has the physical tools to stop these next gen guys. Really hoping to see him force a fumble on josh Allen with a big hit the next time he tries to scramble on us. Will also be clutch against guys like Lamar, Tua, watson (assuming his career isnt over) and even may take the scrambling option away from sometimes scramblers like mahomes or tannehill. Absolutely necessary if make it to the AFC championship game, itll likely be against one of those QBs.
1619457230.0	Steelers	Gilbert was solid when not hurt	31	0.5229	team	0	gvy8mmy	Gilbert was solid when not hurt
1619457232.0	Eagles	Hes a 32 year old receiver with a gigantic contract. At best youll get 3 more seasons from him. I wouldnt trade for him since he doesnt fit the timeline or cap. But if a contender thought he could put them over the top I could see him fetching a 2nd or 3rd.	257	0.6117	team	0	gvy8mut	Hes a 32 year old receiver with a gigantic contract. At best youll get 3 more seasons from him. I wouldnt trade for him since he doesnt fit the timeline or cap. But if a contender thought he could put them over the top I could see him fetching a 2nd or 3rd.
1619457237.0	49ers	Thats the correct take bc even if Fields goes somewhere and doesnt play well... that doesnt mean that he wouldnt have been special with this team, staff and system.	164	-0.6259	team	0	gvy8n9l	Thats the correct take bc even if Fields goes somewhere and doesnt play well... that doesnt mean that he wouldnt have been special with this team, staff and system.
1619457240.0	Buccaneers	At some point all of our curses cancelled each other out last year.	67	0.0	team	0	gvy8ni4	At some point all of our curses cancelled each other out last year.
1619457241.0	Ravens	Im a huge believer in Jaelan Phillips to the point Id be happy with the ravens trading up for him.	98	0.7184	team	0	gvy8nkj	Im a huge believer in Jaelan Phillips to the point Id be happy with the ravens trading up for him.
1619457242.0	Patriots	15 QB Trey Lance, North Dakota State  Wanted to grab a top 5 The top WRs and Horn were gone and I dont like Parson46 WR Rondale Moore, Purdue We need a WR after Eledmen lef An explosive slot receiver  Aboveaverage speed and strenght He is also a great punt returner 96  EDGE Patrick Jones II, Pitt 17.5 sacks in two years Big guy (64 and 261 lbs) with agility and speed Respected team captains120  RB Chuba Hubbard, Oklahoma State Rushed for 2,000 yards and 21 TDs in 2019 No career fumbles Patient and good foot work122 S Talanoa Hufanga, USC Allaround good player and underrated safety Explosive, hitshard, and great against the run Could be like Adrian Phillips, an LBSS role If there were no concerns about injury, he would be second rounder139 EDGE Chris Rumph II, Duke Thin but tall player Tough player and unwilling to give in as a pass rusher Best player available 177 EDGE Victor Dimukeje, Duke Powerful Edge Can get to the QB Could be good on 3rd and short188 WR Frank Darby, Arizona State Averaged over 20 yards per catch over the first three seasons Nearly 20 percent of his catches resulted in touchdowns Tough receiver and could be a blocker and deepRedZone threat197  QB Sam Ehlinger, Texas Low risk, high possible reward Has a decent arm and can run 242  OT Adrian Ealy, Oklahoma Sleeper pick Oklahoma has produced a lot of good Olinemen Another big guy (66 and 321 lbs) and although struggle with speedy guys, he can block big DE well Would add depth to the position	1483	0.9688	team	0	gvy8nnx	15 QB Trey Lance, North Dakota State  Wanted to grab a top 5 The top WRs and Horn were gone and I dont like Parson46 WR Rondale Moore, Purdue We need a WR after Eledmen lef An explosive slot receiver  Aboveaverage speed and strenght He is also a great punt returner 96  EDGE Patrick Jones II, Pitt 17.5 sacks in two years Big guy (64 and 261 lbs) with agility and speed Respected team captains120  RB Chuba Hubbard, Oklahoma State Rushed for 2,000 yards and 21 TDs in 2019 No career fumbles Patient and good foot work122 S Talanoa Hufanga, USC Allaround good player and underrated safety Explosive, hitshard, and great against the run Could be like Adrian Phillips, an LBSS role If there were no concerns about injury, he would be second rounder139 EDGE Chris Rumph II, Duke Thin but tall player Tough player and unwilling to give in as a pass rusher Best player available 177 EDGE Victor Dimukeje, Duke Powerful Edge Can get to the QB Could be good on 3rd and short188 WR Frank Darby, Arizona State Averaged over 20 yards per catch over the first three seasons Nearly 20 percent of his catches resulted in touchdowns Tough receiver and could be a blocker and deepRedZone threat197  QB Sam Ehlinger, Texas Low risk, high possible reward Has a decent arm and can run 242  OT Adrian Ealy, Oklahoma Sleeper pick Oklahoma has produced a lot of good Olinemen Another big guy (66 and 321 lbs) and although struggle with speedy guys, he can block big DE well Would add depth to the position
1619457244.0	Jets	I dont know man, Ive had dreams of sliding Mekhi to RT to be our run blocker and let Sewell lock down LT. We would be a pretty safe top 5 OL for the next 56 years	162	0.8625	team	0	gvy8nul	I dont know man, Ive had dreams of sliding Mekhi to RT to be our run blocker and let Sewell lock down LT. We would be a pretty safe top 5 OL for the next 56 years
1619457246.0	Bears	No chance, and he wont be there	31	-0.1877	team	0	gvy8nzg	No chance, and he wont be there
1619457248.0	Eagles	Its dependent on whos left. If the top talent for WR (Waddle, Smith) and CB (Surtain, Horn) are all gone and we cant trade down  Im not opposed	143	0.5574	team	0	gvy8o7o	Its dependent on whos left. If the top talent for WR (Waddle, Smith) and CB (Surtain, Horn) are all gone and we cant trade down  Im not opposed
1619457249.0	Broncos	Lombardi, Allbright, and I think even Klis have said there were conversations about Teddy between the two teams this offseason. I dont think this was just connecting the dots.	175	0.0	team	0	gvy8o9r	Lombardi, Allbright, and I think even Klis have said there were conversations about Teddy between the two teams this offseason. I dont think this was just connecting the dots.
1619457250.0	Vikings	Round three.	12	0.0	team	0	gvy8oci	Round three.
1619457251.0	Steelers	Why would you think we go Najee and not OT? OT has like 5 guys that are worth top 30 picks. RB has more guys in the 3060 range.	127	0.6369	team	0	gvy8ofn	Why would you think we go Najee and not OT? OT has like 5 guys that are worth top 30 picks. RB has more guys in the 3060 range.
1619457253.0	Browns	Mel Kiper was hollin	20	0.0	team	0	gvy8okn	Mel Kiper was hollin
1619457254.0	Eagles	Yeah my post was really meant to the one you responded to. Talking yourself into the idea that a tight end isnt really a tight end is how you make bad decisions. That being said, I expect a bad decision no matter what.	218	-0.7072	team	0	gvy8op7	Yeah my post was really meant to the one you responded to. Talking yourself into the idea that a tight end isnt really a tight end is how you make bad decisions. That being said, I expect a bad decision no matter what.
1619457264.0	Cowboys	Happy retirement to one of my favorite Cowboys. Hope we can retain him on the staff in some way.	96	0.8625	team	0	gvy8pfp	Happy retirement to one of my favorite Cowboys. Hope we can retain him on the staff in some way.
1619457268.0	Patriots	Yes	3	0.4019	team	0	gvy8pt1	Yes
1619457269.0	Texans	Baring the worst case scenarios of Watson being banned from the league or going to prison, we should still be able to trade him right? He is still a YOUNG top 5 QB in the league and someone will pay up for him. If there is any value drop maybe he is worth 2 or 3 firsts instead of 4? Idk if this is just me being naive or hopeful but I have a really hard time believing that we just lose all value from him and get nothing in return.	433	-0.7468	team	0	gvy8puu	Baring the worst case scenarios of Watson being banned from the league or going to prison, we should still be able to trade him right? He is still a YOUNG top 5 QB in the league and someone will pay up for him. If there is any value drop maybe he is worth 2 or 3 firsts instead of 4? Idk if this is just me being naive or hopeful but I have a really hard time believing that we just lose all value from him and get nothing in return.
1619457270.0	49ers	I do not consider myself a draftnik. I enjoy speaking to scouts and people whove done the work and know what theyre looking for. Then, I like to see how it all plays out down the road. My favorite subject to cover are the people. I like learning what makes guys tick. Thats something that was lacking last year during COVID, because there was no locker room access.	365	0.875	team	0	gvy8pxw	I do not consider myself a draftnik. I enjoy speaking to scouts and people whove done the work and know what theyre looking for. Then, I like to see how it all plays out down the road. My favorite subject to cover are the people. I like learning what makes guys tick. Thats something that was lacking last year during COVID, because there was no locker room access.
1619457278.0	Buccaneers	Good point	10	0.4404	team	0	gvy8qks	Good point
1619457279.0	Broncos	Dont players also have to askpotentially pay other players for their number if its taken? Like if Jeudy wants 4 doesnt he have to go through Rypien or is there some exception I dont know about?	193	0.4137	team	0	gvy8qp5	Dont players also have to askpotentially pay other players for their number if its taken? Like if Jeudy wants 4 doesnt he have to go through Rypien or is there some exception I dont know about?
1619457281.0	Patriots	Lol he was hurt last year. Every year before he missed one or two games.	72	-0.4215	team	0	gvy8quk	Lol he was hurt last year. Every year before he missed one or two games.
1619457285.0	Patriots	For more context as to why Shanahan seems to be so deadset on Mac Jones, Lombardi went into more detail on this segment here(httpstwitter.comVSiNLivestatus1386665363371270147). Its also interesting when you see the betting odds for Trey Lance and Justin Fields and where the Patriots are in relation to it. It was higher than I expected.Also someone tweeted out a page from Lombardis book(httpstwitter.comBallhawksFBstatus1386708779920723982) about Bill Walshs description of what is needed from a QB in the West Coast offense and how it fits Mac Jones to a T in relation to why Shanahan would want him.	603	0.25	team	0	gvy8r7o	For more context as to why Shanahan seems to be so deadset on Mac Jones, Lombardi went into more detail on this segment here(httpstwitter.comVSiNLivestatus1386665363371270147). Its also interesting when you see the betting odds for Trey Lance and Justin Fields and where the Patriots are in relation to it. It was higher than I expected.Also someone tweeted out a page from Lombardis book(httpstwitter.comBallhawksFBstatus1386708779920723982) about Bill Walshs description of what is needed from a QB in the West Coast offense and how it fits Mac Jones to a T in relation to why Shanahan would want him.
1619457288.0	49ers	This tweet leaves out some convenient info.He properly identified Cousins in  the draft and drafted him in the 4th. Hes still in the NFL (how many 4th round QBs make it this long?) while the number 1 pick (who he helped turn into ROTY) is not.He took Jimmy G to a SB in  his only full season as starter and Jimmy posted one of the best QB seasons the Niners have had this century. How would that Watson pick be looking right now? He missed on Mahomes which is probably a big contributor to why were looking for a QB now.	520	0.5661	team	0	gvy8rfx	This tweet leaves out some convenient info.He properly identified Cousins in  the draft and drafted him in the 4th. Hes still in the NFL (how many 4th round QBs make it this long?) while the number 1 pick (who he helped turn into ROTY) is not.He took Jimmy G to a SB in  his only full season as starter and Jimmy posted one of the best QB seasons the Niners have had this century. How would that Watson pick be looking right now? He missed on Mahomes which is probably a big contributor to why were looking for a QB now.
1619457296.0	Cowboys	I recall him covering Jerry Rice.	33	0.0	team	0	gvy8s46	I recall him covering Jerry Rice.
1619457301.0	49ers	Im very skeptical about all the reports from the media about not drafting Fields. It seems like the 49ers are really good about not leaking information, so why are the Jones and Lance rumors flying around? Who is letting that out if its true?	242	0.7399	team	0	gvy8sjh	Im very skeptical about all the reports from the media about not drafting Fields. It seems like the 49ers are really good about not leaking information, so why are the Jones and Lance rumors flying around? Who is letting that out if its true?
1619457302.0	Ravens	All 3 are bad.  Congrats, you played yourself	45	0.3182	team	0	gvy8smf	All 3 are bad.  Congrats, you played yourself
1619457305.0	Patriots	We have one stud, a couple guys with potential that we cant quite judge yet, and thats pretty decent for a single draft unless both the players with potential end up failing.	174	-0.0258	team	0	gvy8sv7	We have one stud, a couple guys with potential that we cant quite judge yet, and thats pretty decent for a single draft unless both the players with potential end up failing.
1619457307.0	Jets	Youd have to watch the videos he makes of each individual QB to get a sense of why he ranked them as he did.	108	0.0	team	0	gvy8t2f	Youd have to watch the videos he makes of each individual QB to get a sense of why he ranked them as he did.
1619457309.0	Packers	oh for sure. carolina was 151 that year, right? and MVP cam? yeah we werent gonna come close to beating them hahaha	115	0.6662	team	0	gvy8t7v	oh for sure. carolina was 151 that year, right? and MVP cam? yeah we werent gonna come close to beating them hahaha
1619457309.0	Steelers	best? you suddenly forget Pouncey and Decastro? Two all pros taken in the first? How many all pros or even pro bowl nods have later round OL players gotten us recently? Villy doesnt really count as he got it from popularity	223	0.8105	team	0	gvy8t99	best? you suddenly forget Pouncey and Decastro? Two all pros taken in the first? How many all pros or even pro bowl nods have later round OL players gotten us recently? Villy doesnt really count as he got it from popularity
1619457311.0	Giants	Pretty poor value to take a guard 11 overall unless you are convinced he is the next Quenton Nelson.  Seeing as he hasnt played guard since highschool Im not sure I can be that confident.	187	0.6599	team	0	gvy8tfi	Pretty poor value to take a guard 11 overall unless you are convinced he is the next Quenton Nelson.  Seeing as he hasnt played guard since highschool Im not sure I can be that confident.
1619457312.0	Seahawks	F*** at this rate might as well trade him to the niners for third overall jfc low first round picks are not going to do s****	125	-0.7964	team	0	gvy8ti9	Fuck at this rate might as well trade him to the niners for third overall jfc low first round picks are not going to do shit.
1619457324.0	Patriots	It would basically chew up the remainder of their cap room as of right now. Teams dont have to have a full accounting of their salary cap until final roster cutdowns ahead of Week 1, and if they did get Jones it would mean almost certainly a veteran(s) would have to be cut.	274	0.0018	team	0	gvy8uhz	It would basically chew up the remainder of their cap room as of right now. Teams dont have to have a full accounting of their salary cap until final roster cutdowns ahead of Week 1, and if they did get Jones it would mean almost certainly a veteran(s) would have to be cut.
1619457333.0	Dolphins	So, is it only acceptable to cheer when the Fins do well and we must stay quiet when we are not happy with them?	112	0.5722	team	0	gvy8vav	So, is it only acceptable to cheer when the Fins do well and we must stay quiet when we are not happy with them?
1619457335.0	Patriots	Lol no way we would want a top 5 wr. s	38	0.4019	team	0	gvy8vhs	Lol no way we would want a top 5 wr. s
1619457336.0	Ravens	Why not? His money isnt that bad over the next 2 years. Its WR2 money. And the cap will go up.	94	0.431	team	0	gvy8vka	Why not? His money isnt that bad over the next 2 years. Its WR2 money. And the cap will go up.
1619457338.0	Titans	Bro hed give up 11 to let Julio Wear it	39	0.0	team	0	gvy8vpq	Bro hed give up 11 to let Julio Wear it
1619457340.0	Steelers	Sploosh.	8	0.0	team	0	gvy8vvp	Sploosh.
1619457340.0	49ers	I dont think we should assume anyone else in the org is qualified to override Shanahans choice.  If we do then why is that guy not running our offense?	151	0.1877	team	0	gvy8vwb	I dont think we should assume anyone else in the org is qualified to override Shanahans choice.  If we do then why is that guy not running our offense?
1619457341.0	Broncos	Who cares	9	0.4588	team	0	gvy8vzf	Who cares
1619457341.0	Eagles	Thats exactly where Im at. Were either going to go 413 or make a run of what it looked like was there comes together. Either way Im looking forward to it which i couldnt say for any Sunday last year	198	0.3612	team	0	gvy8w0o	Thats exactly where Im at. Were either going to go 413 or make a run of what it looked like was there comes together. Either way Im looking forward to it which i couldnt say for any Sunday last year
1619457343.0	49ers	For real. We are passing on a complete player IMO	49	0.0	team	0	gvy8w4z	For real. We are passing on a complete player IMO
1619457343.0	Browns	Same here. Just checked back here to see if I was left out. Lol	63	0.4215	team	0	gvy8w65	Same here. Just checked back here to see if I was left out. Lol
1619457346.0	Steelers	Unfortunately he was hurt often.	32	-0.7003	team	0	gvy8wf3	Unfortunately he was hurt often.
1619457347.0	Eagles	For real. Anyone else remember Fletcher Cox?	44	0.0	team	0	gvy8wik	For real. Anyone else remember Fletcher Cox?
1619457349.0	Buccaneers	I mean, do we really care?  Dude doesnt really produce much tbh	63	0.5413	team	0	gvy8wp8	I mean, do we really care?  Dude doesnt really produce much tbh
